{
  "schema_version": "1.0.0",
  "revision": "audiobook-pilot-1",
  "evidence_date": "2026-07-20",
  "purpose": "development",
  "domain": "audiobook",
  "normalization": {
    "sample_rate_hz": 16000,
    "channels": 1,
    "sample_format": "float32le",
    "ffmpeg_arguments": [
      "-hide_banner",
      "-loglevel",
      "error",
      "-y",
      "-i",
      "<source>",
      "-ac",
      "1",
      "-ar",
      "16000",
      "-f",
      "f32le",
      "<normalized>"
    ],
    "observed_ffmpeg_version": "8.1.2"
  },
  "summary": {
    "fixture_count": 15,
    "duration_ms": 223680,
    "by_language": {
      "de": {
        "fixture_count": 3,
        "duration_ms": 49030,
        "speaker_count": 3,
        "chapter_count": 3
      },
      "en": {
        "fixture_count": 3,
        "duration_ms": 43880,
        "speaker_count": 3,
        "chapter_count": 3
      },
      "es": {
        "fixture_count": 3,
        "duration_ms": 49900,
        "speaker_count": 3,
        "chapter_count": 3
      },
      "fr": {
        "fixture_count": 3,
        "duration_ms": 38880,
        "speaker_count": 3,
        "chapter_count": 3
      },
      "pt": {
        "fixture_count": 3,
        "duration_ms": 41990,
        "speaker_count": 3,
        "chapter_count": 3
      }
    }
  },
  "fixtures": [
    {
      "id": "audiobook-de-10870_10823_000000",
      "language": "de",
      "locale": null,
      "gold_status": "dataset-transcript-unverified",
      "dataset": "facebook/multilingual_librispeech",
      "dataset_revision": "2e83e61823b4c47dcbcb1980bb88601274127609",
      "config": "german",
      "split": "dev",
      "row_index": 0,
      "row_id": "10870_10823_000000",
      "speaker_id": "10870",
      "chapter_id": "10823",
      "original_path": "http://www.archive.org/download/ligeia_und_andere_novellen_1608_librivox/ligeia_02_poe_64kb.mp3",
      "begin_time": 1456.07,
      "end_time": 1474.7,
      "reference_text": "wie aber kam sie hier auf meinen tisch und warum schauderte ich wenn ich sie ansah diese fragen wollten sich in keiner weise beantworten lassen meine blicke fielen schließlich auf den unterstrichenen satz eines offen vor mir liegenden buches",
      "license": "CC-BY-4.0",
      "redistributable": true,
      "source": {
        "extension": "opus",
        "media_type": "audio/ogg",
        "bytes": 80847,
        "sha256": "a64459605dd8a3366fbc2b9aec7bfd96a10cf327966e01a0cfbcb24b11f2a53c"
      },
      "normalized": {
        "extension": "f32le",
        "media_type": "audio/x-raw; format=f32le",
        "bytes": 1192320,
        "sha256": "663956f49b2e5ce47356379aeb0a9225a79bcfddc06985c85c80f8a0265234cd",
        "sample_count": 298080,
        "duration_ms": 18630
      }
    },
    {
      "id": "audiobook-de-4001_2999_000089",
      "language": "de",
      "locale": null,
      "gold_status": "dataset-transcript-unverified",
      "dataset": "facebook/multilingual_librispeech",
      "dataset_revision": "2e83e61823b4c47dcbcb1980bb88601274127609",
      "config": "german",
      "split": "dev",
      "row_index": 1156,
      "row_id": "4001_2999_000089",
      "speaker_id": "4001",
      "chapter_id": "2999",
      "original_path": "http://www.archive.org/download/simplicissimus_teil1_0910_librivox/simplicissimus_1_33_grimmelshausen_64kb.mp3",
      "begin_time": 193,
      "end_time": 210.06,
      "reference_text": "der feind hielt sich still als wir in ihren halt kamen ließ uns auch passieren damit wann sie uns angegriffen hätten die konvoi nicht gewarnet würde bis sie auch zu ihnen in die enge käme schickte uns aber einen kornett mit acht reutern nach die uns im gesicht behielten",
      "license": "CC-BY-4.0",
      "redistributable": true,
      "source": {
        "extension": "opus",
        "media_type": "audio/ogg",
        "bytes": 73774,
        "sha256": "ca8d718e114c31f0bc91b49eb9329fc9dfebef033e2b8cd96c46b63cc579baea"
      },
      "normalized": {
        "extension": "f32le",
        "media_type": "audio/x-raw; format=f32le",
        "bytes": 1091840,
        "sha256": "67e5c2a267afc5886dcc5640a1a27b5aa1b2a131ba944fe7f8a31dbae66e09ab",
        "sample_count": 272960,
        "duration_ms": 17060
      }
    },
    {
      "id": "audiobook-de-135_82_000105",
      "language": "de",
      "locale": null,
      "gold_status": "dataset-transcript-unverified",
      "dataset": "facebook/multilingual_librispeech",
      "dataset_revision": "2e83e61823b4c47dcbcb1980bb88601274127609",
      "config": "german",
      "split": "dev",
      "row_index": 2312,
      "row_id": "135_82_000105",
      "speaker_id": "135",
      "chapter_id": "82",
      "original_path": "http://www.archive.org/download/winnetou1_librivox/winnetou1_02_may_64kb.mp3",
      "begin_time": 3223.42,
      "end_time": 3236.76,
      "reference_text": "haltet den schnabel sir ich habe euch doch nur deshalb hinausgeschickt damit mein altes gun wieder einmal mitreden kann kehrt ihr zurück so sucht mich auf und erzählt was ihr erlebt und erfahren habt",
      "license": "CC-BY-4.0",
      "redistributable": true,
      "source": {
        "extension": "opus",
        "media_type": "audio/ogg",
        "bytes": 58021,
        "sha256": "64c7ac18cbe047950ba9bca37303a9b233d442f66c76d98252b7f86a1e897166"
      },
      "normalized": {
        "extension": "f32le",
        "media_type": "audio/x-raw; format=f32le",
        "bytes": 853760,
        "sha256": "72b384abfc6030528d5e60f8b84464c5951341152691537c55a623ae1fba4f4a",
        "sample_count": 213440,
        "duration_ms": 13340
      }
    },
    {
      "id": "audiobook-en-2277-149874-0000",
      "language": "en",
      "locale": null,
      "gold_status": "dataset-transcript-unverified",
      "dataset": "openslr/librispeech_asr",
      "dataset_revision": "71cacbfb7e2354c4226d01e70d77d5fca3d04ba1",
      "config": "clean",
      "split": "validation",
      "row_index": 73,
      "row_id": "2277-149874-0000",
      "speaker_id": "2277",
      "chapter_id": "149874",
      "original_path": null,
      "begin_time": null,
      "end_time": null,
      "reference_text": "MINNIE'S FLAT AS THE ONE FLOOR RESIDENT APARTMENTS WERE THEN BEING CALLED WAS IN A PART OF WEST VAN BUREN STREET INHABITED BY FAMILIES OF LABOURERS AND CLERKS MEN WHO HAD COME AND WERE STILL COMING WITH THE RUSH OF POPULATION POURING IN AT THE RATE OF FIFTY THOUSAND A YEAR",
      "license": "CC-BY-4.0",
      "redistributable": true,
      "source": {
        "extension": "flac",
        "media_type": "audio/flac",
        "bytes": 281560,
        "sha256": "c68896fa95aff5c7fdb3da1818829abe1b2f8b8c3a2660a92d739895e8294949"
      },
      "normalized": {
        "extension": "f32le",
        "media_type": "audio/x-raw; format=f32le",
        "bytes": 992320,
        "sha256": "e393548961cfd11b2ca59aa25e68984f551f952165ad1d18a485505b3bf16d41",
        "sample_count": 248080,
        "duration_ms": 15505
      }
    },
    {
      "id": "audiobook-en-6313-76958-0021",
      "language": "en",
      "locale": null,
      "gold_status": "dataset-transcript-unverified",
      "dataset": "openslr/librispeech_asr",
      "dataset_revision": "71cacbfb7e2354c4226d01e70d77d5fca3d04ba1",
      "config": "clean",
      "split": "validation",
      "row_index": 903,
      "row_id": "6313-76958-0021",
      "speaker_id": "6313",
      "chapter_id": "76958",
      "original_path": null,
      "begin_time": null,
      "end_time": null,
      "reference_text": "KEEP A GOING AND IF YOU'RE LUCKY YOU'LL RUN PLUMB INTO THEM WAS THE JEERING ANSWER AS THE SLEEPY COWMEN SPURRED THEIR PONIES ON TOWARD CAMP MUTTERING THEIR DISAPPROVAL OF TAKING ALONG A BUNCH OF BOYS ON A CATTLE DRIVE",
      "license": "CC-BY-4.0",
      "redistributable": true,
      "source": {
        "extension": "flac",
        "media_type": "audio/flac",
        "bytes": 223912,
        "sha256": "0dd89e2bf8c60e05264bf2539f0ec35bc65efb55cd952b3510fa243de9cc16ff"
      },
      "normalized": {
        "extension": "f32le",
        "media_type": "audio/x-raw; format=f32le",
        "bytes": 763200,
        "sha256": "4ea9717af8c458804761b938f9598256ce26b1a48bb4b7923f4efaea6cad2d9b",
        "sample_count": 190800,
        "duration_ms": 11925
      }
    },
    {
      "id": "audiobook-en-2428-83705-0002",
      "language": "en",
      "locale": null,
      "gold_status": "dataset-transcript-unverified",
      "dataset": "openslr/librispeech_asr",
      "dataset_revision": "71cacbfb7e2354c4226d01e70d77d5fca3d04ba1",
      "config": "clean",
      "split": "validation",
      "row_index": 1835,
      "row_id": "2428-83705-0002",
      "speaker_id": "2428",
      "chapter_id": "83705",
      "original_path": null,
      "begin_time": null,
      "end_time": null,
      "reference_text": "I DO NOT KNOW WHEN IT IS GOING TO BE BUT IT WILL BE EITHER NEXT WEEK OR THE WEEK AFTER CERTAINLY AT THE EARLIEST POSSIBLE MOMENT AND I SHOULDN'T BE AT ALL SURPRISED TO LEARN THAT ALL MARY ANN'S THINGS HAD BEEN ALREADY BOUGHT AND PERHAPS SOME OF THEM MARKED",
      "license": "CC-BY-4.0",
      "redistributable": true,
      "source": {
        "extension": "flac",
        "media_type": "audio/flac",
        "bytes": 270225,
        "sha256": "38bb29c24e93204d4c73bea50f29aa414f6d8f339dda4a082d733206025315cf"
      },
      "normalized": {
        "extension": "f32le",
        "media_type": "audio/x-raw; format=f32le",
        "bytes": 1052800,
        "sha256": "366d086afd57d3cb8dcdb2fd99ebcdcf9690da34e58d4be62c790b725191d40b",
        "sample_count": 263200,
        "duration_ms": 16450
      }
    },
    {
      "id": "audiobook-es-10367_10282_000000",
      "language": "es",
      "locale": null,
      "gold_status": "dataset-transcript-unverified",
      "dataset": "facebook/multilingual_librispeech",
      "dataset_revision": "2e83e61823b4c47dcbcb1980bb88601274127609",
      "config": "spanish",
      "split": "dev",
      "row_index": 0,